{
  "apiVersion": "agentlock.dev/v0.1",
  "kind": "ReleaseAttestation",
  "metadata": {
    "attestationVersion": "0.1.0",
    "generatedAt": "2026-04-29T12:30:00Z",
    "issuer": "synthetic-release-control"
  },
  "subject": {
    "bundleName": "claims-triage-agent",
    "bundleVersion": "0.1.0",
    "digests": {
      "genome": "sha256:0f5d8b6c2e194cbdd9f47a7f9fa38a8bc4bb0d9d091e0c4f97029a9f7b9c3001",
      "lock": "sha256:5c7a5f2b5192ee3fda4ac8d8d1b9cb6b5260d46f71a8e0ac0d2d5b7f6a1ec002",
      "behaviorContract": "sha256:b8a5c69942c8b6c3c3fd17bf249abdc2df9541f5b8d66781f4fca946f2ef3003"
    }
  },
  "statement": {
    "releaseStatus": "approved",
    "summary": "Synthetic replay passed all deterministic gates and met probabilistic thresholds for claim triage.",
    "replayResult": "pass",
    "approvedBy": [
      "claims-governance-reviewer",
      "synthetic-risk-ops"
    ],
    "validUntil": "2026-07-29T00:00:00Z"
  },
  "evidence": {
    "replayManifestDigest": "sha256:c4d8f4ae5577db230d42cc5c7d88b9803a5b9f8f861e6ec0a1d6585a1f9ef004",
    "traceSetDigest": "sha256:d7aaf08236b8d9207e10acb7bd1d4f6b0603fc0cb794cc5ec8dd4d85d9ba1005",
    "approvalRecordDigest": "sha256:e6bb11c3aa904c8fe29d6e0ef3a913b9bdf96cfef812e3f52d3f1b7ab85aa006",
    "notesDigest": "sha256:f163a7f91ab02cb834e50c5102c5b7b16a15e1a4f7d3d0930d10f32bb73a7007"
  },
  "approvals": [
    {
      "approverRole": "claims-governance-reviewer",
      "decision": "approved",
      "rationaleDigest": "sha256:0b1c3d4e5f60718293a4b5c6d7e8f9011234567890abcdef1234567890abcd11"
    },
    {
      "approverRole": "synthetic-risk-ops",
      "decision": "approved",
      "rationaleDigest": "sha256:1c2d3e4f5061728394a5b6c7d8e9f012234567890abcdef1234567890abcd122"
    }
  ],
  "signatures": [
    {
      "keyId": "release-ed25519-key-01",
      "algorithm": "ed25519",
      "signature": "QWdlbnRMb2NrLVYwLjEtU2lnbmVkLVJlbGVhc2UtQ2xhaW1zLTAx",
      "signedAt": "2026-04-29T12:31:00Z"
    }
  ]
}
